{"$schema":"https://json-schema.org/draft/2020-12/schema","$id":"https://umn.example/schemas/vamos-run-metadata.schema.json","schema_version":"1.0","type":"object","required":["record_schema_version","run_id","stage_id","caller","caller_version","analysis_source","associated_sequence_id","source_fasta_record_id","assignment_state","status","command_record_paths","input_file_ids","native_output_file_ids","catalog_identity","started_utc","completed_utc","warnings","failure"],"properties":{"record_schema_version":{"const":"1.0"},"run_id":{"type":"string"},"stage_id":{"enum":["03_run_vamos_read","04_run_vamos_contig"]},"caller":{"const":"VAMOS"},"caller_version":{"type":["string","null"]},"raw_version_output":{"type":["string","null"]},"analysis_source":{"enum":["RAW_READS","ASSEMBLED_CONTIG"]},"associated_sequence_id":{"type":["string","null"]},"source_fasta_record_id":{"type":["string","null"]},"assignment_state":{"enum":["DIRECT_SEQUENCE_ASSOCIATION","UNASSIGNED","ASSIGNMENT_NOT_APPLICABLE"]},"status":{"enum":["PLANNED","RUNNING","SUCCEEDED","FAILED","DRY_RUN","TOOL_MISSING","INPUT_MISSING","UNSUPPORTED_VERSION","UNSUPPORTED_FORMAT"]},"command_record_paths":{"type":"array","items":{"type":"string"}},"input_file_ids":{"type":"array","items":{"type":"string"}},"native_output_file_ids":{"type":"array","items":{"type":"string"}},"catalog_identity":{"type":["object","null"]},"started_utc":{"type":"string"},"completed_utc":{"type":["string","null"]},"warnings":{"type":"array","items":{"type":"string"}},"failure":{"type":["object","null"]}},"additionalProperties":true}
